{
  "schema": "kernform.state/v1",
  "generator_version": "0.1.0",
  "project_root": "example-library",
  "manifest_hash": "f66be6b0ac3db280517aeacd6db98893296497beccd1e90aef6df4b956008f25",
  "toolchains": {
    "catalog_id": "stable-2026-07-18-linux-amd64",
    "catalog_hash": "b83d3720ba10c51b49a5d349069b3cf194a613fdf813056e58b3fbc61675fb8b"
  },
  "files": [
    {
      "path": ".github/workflows/ci.yml",
      "hash": "d1144011ff8ea3bdff15d9a54c3f34731210f420a59ccaf9ee8bfb6bfda7c4ea",
      "ownership": "generated"
    },
    {
      "path": ".gitignore",
      "hash": "c7f747efb8ab382efb12d4067eb6c911d7d602f148c1b7de07180e56e5c224b5",
      "ownership": "managed"
    },
    {
      "path": ".kernform/release-flow.toml",
      "hash": "7cbaadb6fc0f2b0cb17e09b63f90222e41f720861aaa70780dbed59dd2876f18",
      "ownership": "managed"
    },
    {
      "path": ".kernform/toolchains.lock.toml",
      "hash": "ab8ee5b253682d10ec0d64c650bcd1de7623d8dd1d9346b5041f3a3b4515f348",
      "ownership": "generated"
    },
    {
      "path": ".python-version",
      "hash": "3a55324cbeddc91df012407d051dad08c88624c95a82fbdb856728729fbd14ab",
      "ownership": "generated"
    },
    {
      "path": "Cargo.lock",
      "hash": "32020270c83a9e0375b8feccd3584886b439d6fee53fc73ada974424ca667c86",
      "ownership": "generated"
    },
    {
      "path": "Cargo.toml",
      "hash": "d106e9a05835f7bc97a828291f89e0143f9ad6f8d40cb04af1491c2cd7a8cf01",
      "ownership": "managed"
    },
    {
      "path": "README.md",
      "hash": "c631da5afcc1dbe547b2940d600c63862bb61fab030f8cbc965e0ca6d16b1870",
      "ownership": "seeded"
    },
    {
      "path": "containers/Containerfile",
      "hash": "20f9f59b2fd77ca66fd5e6119c135eb286aa51f5bb2e2b5d64b1c8f26c86853c",
      "ownership": "managed"
    },
    {
      "path": "containers/compose.dev.yaml",
      "hash": "b5b0a58b3ebd9d5efe0b5f8434975cf9adb56a797d54ac080c4d313dcc07b61c",
      "ownership": "managed"
    },
    {
      "path": "containers/quadlet/example-library.container",
      "hash": "605bde3aa56147381843edc2cc3491b58f00c679c5ab18f363966a91ed1abd7f",
      "ownership": "generated"
    },
    {
      "path": "crates/example-library-core/Cargo.toml",
      "hash": "c0ea3aa5686b7ffae342f87b0e3c33afb6436888c2d738909ca17a5852c4a936",
      "ownership": "managed"
    },
    {
      "path": "crates/example-library-core/src/lib.rs",
      "hash": "73d242b1fa49bb03b5dff4032b3c9b7d8c512389bd0b76c57ea50c95a5f791f0",
      "ownership": "managed"
    },
    {
      "path": "crates/example-library-python/Cargo.toml",
      "hash": "9af859516e246ee07e974bf7472b5d26a482e71223f9f51feacd0bad54cd7542",
      "ownership": "managed"
    },
    {
      "path": "crates/example-library-python/src/lib.rs",
      "hash": "9f235b6543b4a521a075471c37c8be0e903fbbb5be101a16ba94604abe146ba5",
      "ownership": "managed"
    },
    {
      "path": "docs/RELEASE.md",
      "hash": "2d4c69b197ce4227d20383a6cfe3638150a67e6bf1768d75f81809adfcbac962",
      "ownership": "seeded"
    },
    {
      "path": "kernform.toml",
      "hash": "f66be6b0ac3db280517aeacd6db98893296497beccd1e90aef6df4b956008f25",
      "ownership": "managed"
    },
    {
      "path": "pyproject.toml",
      "hash": "71b31aa977f401d9b03212290de89398a62bbcbf6b2db366a423d4fa660f6a8c",
      "ownership": "managed"
    },
    {
      "path": "python/example_library/__init__.py",
      "hash": "2a2c5a7e40f38074ae46f22477ce220878cb1c58d88e927f0dd77507588a63b7",
      "ownership": "managed"
    },
    {
      "path": "python/example_library/_native.pyi",
      "hash": "77b948d886e1f78e150880846966cd8a78a216499360bc85a73a0ac79082905f",
      "ownership": "generated"
    },
    {
      "path": "python/example_library/api.py",
      "hash": "79db62fcb2441a8fa017f49fcd6a76fd96cfee7376835c343a425f99480da8b0",
      "ownership": "managed"
    },
    {
      "path": "python/example_library/models.py",
      "hash": "6df78fd57fef3d3add8fe2b65fc8fdf501b859866a94b2c4d970aaa2e30e1f1d",
      "ownership": "managed"
    },
    {
      "path": "python/example_library/py.typed",
      "hash": "01ba4719c80b6fe911b091a7c05124b64eeece964e09c058ef8f9805daca546b",
      "ownership": "generated"
    },
    {
      "path": "rust-toolchain.toml",
      "hash": "fa0addad5676243d360310f981a69528b0341d295cb5012253d9721aba4d30c0",
      "ownership": "generated"
    },
    {
      "path": "shell/agent/config.nu",
      "hash": "2a1739e465b17cddb3bd271ecdcc3aa4b81139abc6279cb0b227a898e5a634ab",
      "ownership": "generated"
    },
    {
      "path": "shell/agent/env.nu",
      "hash": "80a9c023fd1a14fddb56f21b05980a358e8d3117239faeb1bcbeb067cd8f9d13",
      "ownership": "generated"
    },
    {
      "path": "shell/human/config.nu",
      "hash": "8af91568ec90d8799870fc9e8e5ddd4f409e3aa5bcac46695041f1714bfb6000",
      "ownership": "seeded"
    },
    {
      "path": "shell/human/env.nu",
      "hash": "ee11660136705c6dbe9926c9c8c1ea229a8cfc2278b2230e6eb8393aa0d4001c",
      "ownership": "seeded"
    },
    {
      "path": "shell/modules/kf/container.nu",
      "hash": "f51fbbe209e978094b8f501be80113b1cf1c12d41d3af9535e7d4464d919fc1e",
      "ownership": "managed"
    },
    {
      "path": "shell/modules/kf/inspect.nu",
      "hash": "c437b3795a3c9b3275bbe2faddc4b9d18337f1d8e55c1f9f4b0434b0bd0ead75",
      "ownership": "managed"
    },
    {
      "path": "shell/modules/kf/mod.nu",
      "hash": "2bb701e56b6639e3f378a9ba96ccdc2312eafe3dcf281c833c6aa7062abe19f7",
      "ownership": "managed"
    },
    {
      "path": "shell/modules/kf/project.nu",
      "hash": "6acd45fda86c26eb44df04169f20a6591ec751db004fa7ba0ffc9e6546aaf92a",
      "ownership": "managed"
    },
    {
      "path": "shell/modules/kf/release.nu",
      "hash": "b88ba53b7fd75b4f0dfd5dbb75f4aeceac818343decb9c3bc8bb170a5b4b63c9",
      "ownership": "managed"
    },
    {
      "path": "shell/modules/kf/test.nu",
      "hash": "0f937082896d0db0d945ccc3112eab78f5f5601010804be491ca98c2a0480b05",
      "ownership": "managed"
    },
    {
      "path": "tests/test_api.py",
      "hash": "4ae405f62792fde45be0bb444505491ba06bd6daa4bd18a78c5c74615b14a4c7",
      "ownership": "managed"
    },
    {
      "path": "tests/tiers.toml",
      "hash": "32a72c76f9ec07ea1c63d715000068ba7e3434c1e9fa4095c115c238edc3e03c",
      "ownership": "generated"
    },
    {
      "path": "uv.lock",
      "hash": "7fb3f11d839695e0452a09002e4ec5f35b5db3b38767ecc4f20373bf1ce07ba2",
      "ownership": "generated"
    }
  ]
}
